title,author,school,sentence_ko,sentence_en,original_publication_date,corpus_edition_date,sentence_length,tokenized_txt,lemmatized_str
Enchiridion,Epictetus,stoicism,"신체, 재산, 명성, 직책 등 한 마디로 말해서 우리 자신의 일이 아닌 것은 모두 우리의 힘 너머에 있습니다.","beyond our power are body, property, reputation, office, and, in one word, whatever are not properly our own affairs.",125,2014,117,"['beyond', 'our', 'power', 'are', 'body', 'property', 'reputation', 'office', 'and', 'in', 'one', 'word', 'whatever', 'are', 'not', 'properly', 'our', 'own', 'affairs']"," beyond -PRON- power be body , property , reputation , office , and , in one word , whatever be not properly -PRON- own affair ."
Enchiridion,Epictetus,stoicism,"이제 우리의 힘 안에 있는 것들은 본질적으로 자유롭고, 제한되지 않고, 방해받지 않지만, 우리의 힘 밖에 있는 것들은 약하고, 의존적이며, 제한되고, 이질적입니다.","now the things within our power are by nature free, unrestricted, unhindered; but those beyond our power are weak, dependent, restricted, alien.",125,2014,144,"['now', 'the', 'things', 'within', 'our', 'power', 'are', 'by', 'nature', 'free', 'unrestricted', 'unhindered', 'but', 'those', 'beyond', 'our', 'power', 'are', 'weak', 'dependent', 'restricted', 'alien']"," now the thing within -PRON- power be by nature free , unrestricted , unhindered ; but those beyond -PRON- power be weak , dependent , restricted , alien ."
Enchiridion,Epictetus,stoicism,그러므로 자유를 본질적으로 의존적 인 것에 귀속시키고 다른 사람의 것을 자신의 것으로 취하면 방해받을 것임을 기억하십시오.,"remember, then, that if you attribute freedom to things by nature dependent and take what belongs to others for your own, you will be hindered",125,2014,142,"['remember', 'then', 'that', 'if', 'you', 'attribute', 'freedom', 'to', 'things', 'by', 'nature', 'dependent', 'and', 'take', 'what', 'belongs', 'to', 'others', 'for', 'your', 'own', 'you', 'will', 'be', 'hindered']"," remember , then , that if -PRON- attribute freedom to thing by nature dependent and take what belong to other for -PRON- own , -PRON- will be hinder"
Enchiridion,Epictetus,stoicism,한탄하고 불안해하며 신과 인간 모두에게 잘못을 발견하게 될 것입니다.,", you will lament, you will be disturbed, you will find fault both with gods and men.",125,2014,85,"['you', 'will', 'lament', 'you', 'will', 'be', 'disturbed', 'you', 'will', 'find', 'fault', 'both', 'with', 'gods', 'and', 'men']"," , -PRON- will lament , -PRON- will be disturb , -PRON- will find fault both with god and man ."
Enchiridion,Epictetus,stoicism,그러나 자신의 것만 자신의 것으로 삼고 다른 사람의 것을 있는 그대로 본다면 아무도 강요하지 않고 아무도 제한하지 않으며 아무도 잘못을 찾지 않고 아무도 비난하지 않으며 아무도 자신의 의지에 반하는 일을 하지 않을 것이며 아무도 당신을 해치지 않고 적도 없고 어떤 해로움도 겪지 않을 것입니다.,"but if you take for your own only that which is your own and view what belongs to others just as it really is, then no one will ever compel you, no one will restrict you; you will find fault with no one, you will accuse no one, you will do nothing against your will; no one will hurt you, you will not have an enemy, nor will you suffer any harm.",125,2014,346,"['but', 'if', 'you', 'take', 'for', 'your', 'own', 'only', 'that', 'which', 'is', 'your', 'own', 'and', 'view', 'what', 'belongs', 'to', 'others', 'just', 'as', 'it', 'really', 'is', 'then', 'no', 'one', 'will', 'ever', 'compel', 'you', 'no', 'one', 'will', 'restrict', 'you', 'you', 'will', 'find', 'fault', 'with', 'no', 'one', 'you', 'will', 'accuse', 'no', 'one', 'you', 'will', 'do', 'nothing', 'against', 'your', 'will', 'no', 'one', 'will', 'hurt', 'you', 'you', 'will', 'not', 'have', 'an', 'enemy', 'nor', 'will', 'you', 'suffer', 'any', 'harm']"," but if -PRON- take for -PRON- own only that which be -PRON- own and view what belong to other just as -PRON- really be , then no one will ever compel -PRON- , no one will restrict -PRON- ; -PRON- will find fault with no one , -PRON- will accuse no one , -PRON- will do nothing against -PRON- will ; no one will hurt -PRON- , -PRON- will not have an enemy , nor will -PRON- suffer any harm ."
Enchiridion,Epictetus,stoicism,"그러므로 그러한 위대한 것들을 목표로 삼을 때, 다른 것들의 성취를 향해 조금이라도 기울어지는 것을 허용해서는 안 되며, 그 중 일부는 완전히 그만두고 나머지는 현재로 연기해야 한다는 것을 기억하십시오.","aiming, therefore, at such great things, remember that you must not allow yourself any inclination, however slight, toward the attainment of the others; but that you must entirely quit some of them, and for the present postpone the rest.",125,2014,237,"['aiming', 'therefore', 'at', 'such', 'great', 'things', 'remember', 'that', 'you', 'must', 'not', 'allow', 'yourself', 'any', 'inclination', 'however', 'slight', 'toward', 'the', 'attainment', 'of', 'the', 'others', 'but', 'that', 'you', 'must', 'entirely', 'quit', 'some', 'of', 'them', 'and', 'for', 'the', 'present', 'postpone', 'the', 'rest']"," Aiming , therefore , at such great thing , remember that -PRON- must not allow -PRON- any inclination , however slight , toward the attainment of the other ; but that -PRON- must entirely quit some of -PRON- , and for the present postpone the rest ."
Enchiridion,Epictetus,stoicism,"그러나 이것들을 가지고 권력과 부도 함께 소유한다면, 전자를 추구하다가 후자를 놓칠 수 있으며, 그것만으로 행복과 자유를 얻는 데 실패할 것이 분명합니다.","but if you would have these, and possess power and wealth likewise, you may miss the latter in seeking the former; and you will certainly fail of that by which alone happiness and freedom are procured.",125,2014,201,"['but', 'if', 'you', 'would', 'have', 'these', 'and', 'possess', 'power', 'and', 'wealth', 'likewise', 'you', 'may', 'miss', 'the', 'latter', 'in', 'seeking', 'the', 'former', 'and', 'you', 'will', 'certainly', 'fail', 'of', 'that', 'by', 'which', 'alone', 'happiness', 'and', 'freedom', 'are', 'procured']"," but if -PRON- would have these , and possess power and wealth likewise , -PRON- may miss the latter in seek the former ; and -PRON- will certainly fail of that by which alone happiness and freedom be procure ."
Enchiridion,Epictetus,stoicism,그러므로 모든 불쾌한 모습에 대해 '당신은 겉모습일 뿐 결코 진짜가 아닙니다'라고 말할 수 있도록 즉시 구하십시오.,"seek at once, therefore, to be able to say to every unpleasing semblance, 'you are but a semblance and by no means the real thing.'",125,2014,131,"['seek', 'at', 'once', 'therefore', 'to', 'be', 'able', 'to', 'say', 'to', 'every', 'unpleasing', 'semblance', 'you', 'are', 'but', 'semblance', 'and', 'by', 'no', 'means', 'the', 'real', 'thing']"," seek at once , therefore , to be able to say to every unpleasing semblance , ' -PRON- be but a semblance and by no means the real thing . '"
Enchiridion,Epictetus,stoicism,"그리고 너희가 가지고 있는 규칙에 따라, 그리고 무엇보다도 이것, 즉 그것이 우리의 힘 안에 있는 것들에 관한 것이든 그렇지 않은 것들에 관한 것이든 살펴보고, 만약 그것이 우리의 힘 밖의 것에 관한 것이라면, 너희에게는 아무것도 아니라고 말할 준비를 하라.","and then examine it by those rules which you have; and first and chiefly by this: whether it concerns the things which are within our own power or those which are not; and if it concerns anything beyond our power, be prepared to say that it is nothing to you.",125,2014,259,"['and', 'then', 'examine', 'it', 'by', 'those', 'rules', 'which', 'you', 'have', 'and', 'first', 'and', 'chiefly', 'by', 'this', 'whether', 'it', 'concerns', 'the', 'things', 'which', 'are', 'within', 'our', 'own', 'power', 'or', 'those', 'which', 'are', 'not', 'and', 'if', 'it', 'concerns', 'anything', 'beyond', 'our', 'power', 'be', 'prepared', 'to', 'say', 'that', 'it', 'is', 'nothing', 'to', 'you']"," and then examine -PRON- by those rule which -PRON- have ; and first and chiefly by this : whether -PRON- concern the thing which be within -PRON- own power or those which be not ; and if -PRON- concern anything beyond -PRON- power , be prepare to say that -PRON- be nothing to -PRON- ."
Enchiridion,Epictetus,stoicism,"욕망은 욕망하는 것을 성취할 것을 요구하고, 혐오는 혐오하는 것을 피할 것을 요구하며, 욕망의 대상에서 실패하는 자는 실망하고, 혐오의 대상을 초래하는 자는 비참하다는 것을 기억하십시오.",remember that desire demands the attainment of that of which you are desirous; and aversion demands the avoidance of that to which you are averse; that he who fails of the object of his desires is disappointed; and he who incurs the object of his aversion is wretched.,125,2014,268,"['remember', 'that', 'desire', 'demands', 'the', 'attainment', 'of', 'that', 'of', 'which', 'you', 'are', 'desirous', 'and', 'aversion', 'demands', 'the', 'avoidance', 'of', 'that', 'to', 'which', 'you', 'are', 'averse', 'that', 'he', 'who', 'fails', 'of', 'the', 'object', 'of', 'his', 'desires', 'is', 'disappointed', 'and', 'he', 'who', 'incurs', 'the', 'object', 'of', 'his', 'aversion', 'is', 'wretched']", remember that desire demand the attainment of that of which -PRON- be desirous ; and aversion demand the avoidance of that to which -PRON- be averse ; that -PRON- who fail of the object of -PRON- desire be disappoint ; and -PRON- who incur the object of -PRON- aversion be wretched .
Enchiridion,Epictetus,stoicism,"그러므로 당신이 통제할 수 있는 바람직하지 않은 것들만 피한다면, 당신이 피하는 것은 결코 발생하지 않을 것이지만, 질병이나 죽음이나 가난을 피한다면, 비참한 위험을 초래할 것입니다.","if, then, you shun only those undesirable things which you can control, you will never incur anything which you shun; but if you shun sickness, or death, or poverty, you will run the risk of wretchedness.",125,2014,204,"['if', 'then', 'you', 'shun', 'only', 'those', 'undesirable', 'things', 'which', 'you', 'can', 'control', 'you', 'will', 'never', 'incur', 'anything', 'which', 'you', 'shun', 'but', 'if', 'you', 'shun', 'sickness', 'or', 'death', 'or', 'poverty', 'you', 'will', 'run', 'the', 'risk', 'of', 'wretchedness']"," if , then , -PRON- shun only those undesirable thing which -PRON- can control , -PRON- will never incur anything which -PRON- shun ; but if -PRON- shun sickness , or death , or poverty , -PRON- will run the risk of wretchedness ."
Enchiridion,Epictetus,stoicism,"그러므로 혐오의 습관을 우리의 힘에 속하지 않는 모든 것에서 제거하고, 우리의 힘에 속하는 바람직하지 않은 것들에 적용하세요.","remove the habit of aversion, then, from all things that are not within our power, and apply it to things undesirable which are within our power.",125,2014,145,"['remove', 'the', 'habit', 'of', 'aversion', 'then', 'from', 'all', 'things', 'that', 'are', 'not', 'within', 'our', 'power', 'and', 'apply', 'it', 'to', 'things', 'undesirable', 'which', 'are', 'within', 'our', 'power']"," remove the habit of aversion , then , from all thing that be not within -PRON- power , and apply -PRON- to thing undesirable which be within -PRON- power ."
Enchiridion,Epictetus,stoicism,"그러나 현재로서는 욕망을 모두 자제하라, 우리 힘에 속하지 않는 것을 욕망하면 반드시 실망할 것이요, 우리 힘에 속하는 것을 아직 확보하지 못했기 때문에 정당한 욕망의 대상이다.","but for the present, altogether restrain desire; for if you desire any of the things not within our own power, you must necessarily be disappointed; and you are not yet secure of those which are within our power, and so are legitimate objects of desire.",125,2014,253,"['but', 'for', 'the', 'present', 'altogether', 'restrain', 'desire', 'for', 'if', 'you', 'desire', 'any', 'of', 'the', 'things', 'not', 'within', 'our', 'own', 'power', 'you', 'must', 'necessarily', 'be', 'disappointed', 'and', 'you', 'are', 'not', 'yet', 'secure', 'of', 'those', 'which', 'are', 'within', 'our', 'power', 'and', 'so', 'are', 'legitimate', 'objects', 'of', 'desire']"," but for the present , altogether restrain desire ; for if -PRON- desire any of the thing not within -PRON- own power , -PRON- must necessarily be disappoint ; and -PRON- be not yet secure of those which be within -PRON- power , and so be legitimate object of desire ."
Enchiridion,Epictetus,stoicism,"실제로 무언가를 추구하거나 피해야 할 필요가 있는 경우, 이 경우에도 신중하고 온화하고 절제된 태도로 행동하세요.","where it is practically necessary for you to pursue or avoid anything, do even this with discretion and gentleness and moderation.",125,2014,130,"['where', 'it', 'is', 'practically', 'necessary', 'for', 'you', 'to', 'pursue', 'or', 'avoid', 'anything', 'do', 'even', 'this', 'with', 'discretion', 'and', 'gentleness', 'and', 'moderation']"," where -PRON- be practically necessary for -PRON- to pursue or avoid anything , do even this with discretion and gentleness and moderation ."
Enchiridion,Epictetus,stoicism,"마음을 기쁘게 하거나 쓰임에 기여하거나 부드럽게 사랑받는 모든 물건에 대해, 아주 사소한 것부터 시작하여 그것이 어떤 성질을 지니고 있는지를 상기하십시오: 좋아하는 컵이 있다면, 그것은 당신이 좋아하는 컵일 뿐이므로 깨져도 견딜 수 있고, 자녀나 아내를 안고 있다면, 당신은 필멸자를 안고 있는 것이므로 둘 중 하나가 죽어도 견딜 수 있습니다.","with regard to whatever objects either delight the mind or contribute to use or are tenderly beloved, remind yourself of what nature they are, beginning with the merest trifles: if you have a favorite cup, that it is but a cup of which you are fond of for thus, if it is broken, you can bear it; if you embrace your child or your wife, that you embrace a mortal and thus, if either of them dies, you can bear it.",125,2014,412,"['with', 'regard', 'to', 'whatever', 'objects', 'either', 'delight', 'the', 'mind', 'or', 'contribute', 'to', 'use', 'or', 'are', 'tenderly', 'beloved', 'remind', 'yourself', 'of', 'what', 'nature', 'they', 'are', 'beginning', 'with', 'the', 'merest', 'trifles', 'if', 'you', 'have', 'favorite', 'cup', 'that', 'it', 'is', 'but', 'cup', 'of', 'which', 'you', 'are', 'fond', 'of', 'for', 'thus', 'if', 'it', 'is', 'broken', 'you', 'can', 'bear', 'it', 'if', 'you', 'embrace', 'your', 'child', 'or', 'your', 'wife', 'that', 'you', 'embrace', 'mortal', 'and', 'thus', 'if', 'either', 'of', 'them', 'dies', 'you', 'can', 'bear', 'it']"," with regard to whatever object either delight the mind or contribute to use or be tenderly beloved , remind -PRON- of what nature -PRON- be , begin with the mere trifle : if -PRON- have a favorite cup , that -PRON- be but a cup of which -PRON- be fond of for thus , if -PRON- be break , -PRON- can bear -PRON- ; if -PRON- embrace -PRON- child or -PRON- wife , that -PRON- embrace a mortal and thus , if either of -PRON- die , -PRON- can bear -PRON- ."
Enchiridion,Epictetus,stoicism,어떤 행동을 취할 때는 그 행동이 어떤 성격의 행동인지 상기하세요.,"when you set about any action, remind yourself of what nature the action is.",125,2014,76,"['when', 'you', 'set', 'about', 'any', 'action', 'remind', 'yourself', 'of', 'what', 'nature', 'the', 'action', 'is']"," when -PRON- set about any action , remind -PRON- of what nature the action be ."
Enchiridion,Epictetus,stoicism,"목욕을 할 때 어떤 사람은 쏟아내고, 어떤 사람은 밀고, 어떤 사람은 꾸짖고, 어떤 사람은 훔치는 등 목욕탕에서 흔히 일어나는 일들을 상상해 보세요.","if you are going to bathe, represent to yourself the incidents usual in the bath some persons pouring out, others pushing in, others scolding, others pilfering.",125,2014,160,"['if', 'you', 'are', 'going', 'to', 'bathe', 'represent', 'to', 'yourself', 'the', 'incidents', 'usual', 'in', 'the', 'bath', 'some', 'persons', 'pouring', 'out', 'others', 'pushing', 'in', 'others', 'scolding', 'others', 'pilfering']"," if -PRON- be go to bathe , represent to -PRON- the incident usual in the bath some person pour out , other push in , other scold , other pilfer ."
Enchiridion,Epictetus,stoicism,따라서 '나는 이제 목욕하러 가서 자연과 조화를 이루며 내 의지를 지키겠다'고 스스로에게 말한다면 더 안전하게 이 행동을 할 수 있습니다.,"and thus you will more safely go about this action if you say to yourself, 'i will now go to bathe and keep my own will in harmony with nature.'",125,2014,144,"['and', 'thus', 'you', 'will', 'more', 'safely', 'go', 'about', 'this', 'action', 'if', 'you', 'say', 'to', 'yourself', 'will', 'now', 'go', 'to', 'bathe', 'and', 'keep', 'my', 'own', 'will', 'in', 'harmony', 'with', 'nature']"," and thus -PRON- will more safely go about this action if -PRON- say to -PRON- , ' -PRON- will now go to bathe and keep -PRON- own will in harmony with nature . '"
Enchiridion,Epictetus,stoicism,다른 모든 행동도 마찬가지입니다.,and so with regard to every other action.,125,2014,41,"['and', 'so', 'with', 'regard', 'to', 'every', 'other', 'action']", and so with regard to every other action .
Enchiridion,Epictetus,stoicism,"그러므로 목욕하는 데 장애가 생기면 '내가 원한 것은 목욕하는 것만이 아니라 내 뜻을 자연과 조화롭게 지키기 위함이었으며, 만약 내가 사물에 유머를 잃으면 이렇게 지키지 않으리라'고 말할 수 있을 것이다.","for thus, if any impediment arises in bathing, you will be able to say, 'it was not only to bathe that i desired, but to keep my will in harmony with nature; and i shall not keep it thus if i am out of humor at things that happen.'",125,2014,231,"['for', 'thus', 'if', 'any', 'impediment', 'arises', 'in', 'bathing', 'you', 'will', 'be', 'able', 'to', 'say', 'it', 'was', 'not', 'only', 'to', 'bathe', 'that', 'desired', 'but', 'to', 'keep', 'my', 'will', 'in', 'harmony', 'with', 'nature', 'and', 'shall', 'not', 'keep', 'it', 'thus', 'if', 'am', 'out', 'of', 'humor', 'at', 'things', 'that', 'happen']"," for thus , if any impediment arise in bathing , -PRON- will be able to say , ' -PRON- be not only to bathe that -PRON- desire , but to keep -PRON- will in harmony with nature ; and -PRON- shall not keep -PRON- thus if -PRON- be out of humor at thing that happen . '"
Enchiridion,Epictetus,stoicism,인간은 사물이 아니라 사물을 바라보는 관점에 의해 방해를 받습니다.,"men are disturbed not by things, but by the views which they take of things.",125,2014,76,"['men', 'are', 'disturbed', 'not', 'by', 'things', 'but', 'by', 'the', 'views', 'which', 'they', 'take', 'of', 'things']"," men be disturb not by thing , but by the view which -PRON- take of thing ."
Enchiridion,Epictetus,stoicism,"따라서 죽음은 소크라테스에게 끔찍한 것이 아니며, 그렇지 않았다면 그렇게 보였을 것입니다.","thus death is nothing terrible, else it would have appeared so to socrates.",125,2014,75,"['thus', 'death', 'is', 'nothing', 'terrible', 'else', 'it', 'would', 'have', 'appeared', 'so', 'to', 'socrates']"," thus death be nothing terrible , else -PRON- would have appear so to Socrates ."
Enchiridion,Epictetus,stoicism,"하지만 공포는 죽음에 대한 우리의 관념, 즉 끔찍하다는 생각에서 비롯됩니다.","but the terror consists in our notion of death, that it is terrible.",125,2014,68,"['but', 'the', 'terror', 'consists', 'in', 'our', 'notion', 'of', 'death', 'that', 'it', 'is', 'terrible']"," but the terror consist in -PRON- notion of death , that -PRON- be terrible ."
Meditations,Marcus Aurelius,stoicism," 네가 스스로 즐거워할 때마다 너와 함께 사는 자들 가운데서 네가 본 좋은 부분과 특별한 은사를 생각하고 묵상하라, 곧 하나는 산업, 다른 하나는 겸손, 다른 하나는 풍성함, 다른 하나는 다른 어떤 것에서 보았느니라."," whensoever thou wilt rejoice thyself, think and meditate upon those good parts and especial gifts, which thou hast observed in any of them that live with thee: as industry in one, in another modesty, in another bountifulness, in another some other thing.",170,2008,255,"['whensoever', 'thou', 'wilt', 'rejoice', 'thyself', 'think', 'and', 'meditate', 'upon', 'those', 'good', 'parts', 'and', 'especial', 'gifts', 'which', 'thou', 'hast', 'observed', 'in', 'any', 'of', 'them', 'that', 'live', 'with', 'thee', 'as', 'industry', 'in', 'one', 'in', 'another', 'modesty', 'in', 'another', 'bountifulness', 'in', 'another', 'some', 'other', 'thing']","   Whensoever thou wilt rejoice thyself , think and meditate upon those good part and especial gift , which thou hast observe in any of -PRON- that live with thee : as industry in one , in another modesty , in another bountifulness , in another some other thing ."
Meditations,Marcus Aurelius,stoicism,"너와 함께 사는 여러 미덕의 닮은 점과 비슷한 점, 특히 그들이 한꺼번에 너에게 자신을 나타내는 것만큼 너를 기쁘게 할 수 있는 것은 아무것도 없기 때문이다.","for nothing can so much rejoice thee, as the resemblances and parallels of several virtues, eminent in the dispositions of them that live with thee, especially when all at once, as it were, they represent themselves unto thee.",170,2008,226,"['for', 'nothing', 'can', 'so', 'much', 'rejoice', 'thee', 'as', 'the', 'resemblances', 'and', 'parallels', 'of', 'several', 'virtues', 'eminent', 'in', 'the', 'dispositions', 'of', 'them', 'that', 'live', 'with', 'thee', 'especially', 'when', 'all', 'at', 'once', 'as', 'it', 'were', 'they', 'represent', 'themselves', 'unto', 'thee']"," for nothing can so much rejoice thee , as the resemblance and parallel of several virtue , eminent in the disposition of -PRON- that live with thee , especially when all at once , as -PRON- be , -PRON- represent -PRON- unto thee ."
Meditations,Marcus Aurelius,stoicism,그러므로 항상 준비 태세를 갖추도록 하십시오.,"see therefore, that thou have them always in a readiness.",170,2008,57,"['see', 'therefore', 'that', 'thou', 'have', 'them', 'always', 'in', 'readiness']"," see therefore , that thou have -PRON- always in a readiness ."
Meditations,Marcus Aurelius,stoicism,할아버지 베루스에게서 온화하고 온유하며 모든 분노와 정열을 자제하는 법을 배웠습니다.,"of my grandfather verus i have learned to be gentle and meek, and to refrain from all anger and passion.",170,2008,104,"['of', 'my', 'grandfather', 'verus', 'have', 'learned', 'to', 'be', 'gentle', 'and', 'meek', 'and', 'to', 'refrain', 'from', 'all', 'anger', 'and', 'passion']"," of -PRON- grandfather Verus -PRON- have learn to be gentle and meek , and to refrain from all anger and passion ."
Meditations,Marcus Aurelius,stoicism,나를 낳은 그분의 명성과 기억으로부터,from the fame and memory of him that begot me,170,2008,45,"['from', 'the', 'fame', 'and', 'memory', 'of', 'him', 'that', 'begot', 'me']", from the fame and memory of -PRON- that beget -PRON-
Meditations,Marcus Aurelius,stoicism,저는 부끄러움과 남자다운 행동을 모두 배웠습니다.,i have learned both shamefastness and manlike behaviour.,170,2008,56,"['have', 'learned', 'both', 'shamefastness', 'and', 'manlike', 'behaviour']", -PRON- have learn both shamefastness and manlike behaviour .
Meditations,Marcus Aurelius,stoicism,"어머니에게서 나는 종교적이고 풍요로운 것을 배웠으며, 악을 행할 뿐만 아니라 악을 도모하는 것을 참으며, 여분의 음식으로 만족하고, 큰 부에 부수되는 모든 과잉을 날려 버리는 것을 배웠습니다.","of my mother i have learned to be religious, and bountiful; and to forbear, not only to do, but to intend any evil; to content myself with a spare diet, and to fly all such excess as is incidental to great wealth.",170,2008,213,"['of', 'my', 'mother', 'have', 'learned', 'to', 'be', 'religious', 'and', 'bountiful', 'and', 'to', 'forbear', 'not', 'only', 'to', 'do', 'but', 'to', 'intend', 'any', 'evil', 'to', 'content', 'myself', 'with', 'spare', 'diet', 'and', 'to', 'fly', 'all', 'such', 'excess', 'as', 'is', 'incidental', 'to', 'great', 'wealth']"," of -PRON- mother -PRON- have learn to be religious , and bountiful ; and to forbear , not only to do , but to intend any evil ; to content -PRON- with a spare diet , and to fly all such excess as be incidental to great wealth ."
