title,author,school,sentence_ko,sentence_en,original_publication_date,corpus_edition_date,sentence_length,tokenized_txt,lemmatized_str
Philosophical Investigations,Wittgenstein,analytic,그러나 5라는 단어의 의미는 무엇입니까? 여기서는 그런 것이 아니라 5라는 단어가 어떻게 사용되는지에 대해서만 질문했습니다.,"but what is the meaning of the word five no such thing was in question here, only how the word five is used.",1953,1986,108,"['but', 'what', 'is', 'the', 'meaning', 'of', 'the', 'word', 'five', 'no', 'such', 'thing', 'was', 'in', 'question', 'here', 'only', 'how', 'the', 'word', 'five', 'is', 'used']"," but what be the meaning of the word five no such thing be in question here , only how the word five be use ."
Philosophical Investigations,Wittgenstein,analytic,의미에 대한 철학적 개념은 언어가 기능하는 방식에 대한 원시적인 생각에서 비롯된 것입니다.,that philosophical concept of meaning has its place in a primitive idea of the way language functions.,1953,1986,102,"['that', 'philosophical', 'concept', 'of', 'meaning', 'has', 'its', 'place', 'in', 'primitive', 'idea', 'of', 'the', 'way', 'language', 'functions']", that philosophical concept of meaning have -PRON- place in a primitive idea of the way language function .
Philosophical Investigations,Wittgenstein,analytic,하지만 우리보다 더 원시적인 언어의 아이디어라고도 말할 수 있습니다.,but one can also say that it is the idea of a language more primitive than ours.,1953,1986,80,"['but', 'one', 'can', 'also', 'say', 'that', 'it', 'is', 'the', 'idea', 'of', 'language', 'more', 'primitive', 'than', 'ours']", but one can also say that -PRON- be the idea of a language more primitive than our .
Philosophical Investigations,Wittgenstein,analytic,어거스틴의 설명이 맞는 언어를 상상해 봅시다.,let us imagine a language for which the description given by augustine is right.,1953,1986,80,"['let', 'us', 'imagine', 'language', 'for', 'which', 'the', 'description', 'given', 'by', 'augustine', 'is', 'right']", let -PRON- imagine a language for which the description give by Augustine be right .
Tractatus Logico-Philosophicus,Wittgenstein,analytic,"그리고 사람이 아는 것이 무엇이든, 그가 들은 단순한 우렁찬 소리와 포효가 아닌 것은 세 단어로 말할 수 있습니다.","and whatever a man knows, whatever is not mere rumbling and roaring that he has heard, can be said in three words.",1921,2001,114,"['and', 'whatever', 'man', 'knows', 'whatever', 'is', 'not', 'mere', 'rumbling', 'and', 'roaring', 'that', 'he', 'has', 'heard', 'can', 'be', 'said', 'in', 'three', 'words']"," and whatever a man know , whatever be not mere rumble and roar that -PRON- have hear , can be say in three word ."
Tractatus Logico-Philosophicus,Wittgenstein,analytic,rnberger 아마도이 책은 이미 그 안에 표현 된 생각이나 적어도 비슷한 생각을 가진 사람 만이 이해할 수있을 것입니다.,rnberger perhaps this book will be understood only by someone who has himself already had the thoughts that are expressed in it or at least similar thoughts.,1921,2001,157,"['rnberger', 'perhaps', 'this', 'book', 'will', 'be', 'understood', 'only', 'by', 'someone', 'who', 'has', 'himself', 'already', 'had', 'the', 'thoughts', 'that', 'are', 'expressed', 'in', 'it', 'or', 'at', 'least', 'similar', 'thoughts']", rnberger perhaps this book will be understand only by someone who have -PRON- already have the thought that be express in -PRON- or at least similar thought .
Tractatus Logico-Philosophicus,Wittgenstein,analytic,따라서 교과서가 아닙니다.,so it is not a textbook.,1921,2001,24,"['so', 'it', 'is', 'not', 'textbook']", so -PRON- be not a textbook .
Tractatus Logico-Philosophicus,Wittgenstein,analytic,글을 읽고 이해한 한 사람에게 즐거움을 주었다면 그 목적은 달성된 것입니다.,its purpose would be achieved if it gave pleasure to one person who read and understood it.,1921,2001,91,"['its', 'purpose', 'would', 'be', 'achieved', 'if', 'it', 'gave', 'pleasure', 'to', 'one', 'person', 'who', 'read', 'and', 'understood', 'it']", -PRON- purpose would be achieve if -PRON- give pleasure to one person who read and understand -PRON- .
Tractatus Logico-Philosophicus,Wittgenstein,analytic,"이 책은 철학의 문제를 다루고 있으며, 이러한 문제가 제기되는 이유는 우리 언어의 논리가 잘못 이해되고 있기 때문이라고 생각합니다.","the book deals with the problems of philosophy, and shows, i believe, that the reason why these problems are posed is that the logic of our language is misunderstood.",1921,2001,166,"['the', 'book', 'deals', 'with', 'the', 'problems', 'of', 'philosophy', 'and', 'shows', 'believe', 'that', 'the', 'reason', 'why', 'these', 'problems', 'are', 'posed', 'is', 'that', 'the', 'logic', 'of', 'our', 'language', 'is', 'misunderstood']"," the book deal with the problem of philosophy , and show , -PRON- believe , that the reason why these problem be pose be that the logic of -PRON- language be misunderstood ."
Tractatus Logico-Philosophicus,Wittgenstein,analytic,"이 책의 전체적인 의미는 '말할 수 있는 것은 분명하게 말하고, 말할 수 없는 것은 침묵으로 넘어가야 한다'는 말로 요약할 수 있습니다.","the whole sense of the book might be summed up in the following words: what can be said at all can be said clearly, and what we cannot talk about we must pass over in silence.",1921,2001,175,"['the', 'whole', 'sense', 'of', 'the', 'book', 'might', 'be', 'summed', 'up', 'in', 'the', 'following', 'words', 'what', 'can', 'be', 'said', 'at', 'all', 'can', 'be', 'said', 'clearly', 'and', 'what', 'we', 'cannot', 'talk', 'about', 'we', 'must', 'pass', 'over', 'in', 'silence']"," the whole sense of the book may be sum up in the follow word : what can be say at all can be say clearly , and what -PRON- can not talk about -PRON- must pass over in silence ."
Tractatus Logico-Philosophicus,Wittgenstein,analytic,"따라서 이 책의 목적은 생각의 한계를 그리는 것이 아니라 생각의 표현에 한계를 그리는 것입니다: 생각의 한계를 그리기 위해서는 그 한계의 양쪽을 생각할 수 있어야 하기 때문입니다(즉, 생각할 수 없는 것을 생각할 수 있어야 합니다).","thus the aim of the book is to draw a limit to thought, or rather not to thought, but to the expression of thoughts: for in order to be able to draw a limit to thought, we should have to find both sides of the limit thinkable (i.e. we should have to be able to think what cannot be thought).",1921,2001,291,"['thus', 'the', 'aim', 'of', 'the', 'book', 'is', 'to', 'draw', 'limit', 'to', 'thought', 'or', 'rather', 'not', 'to', 'thought', 'but', 'to', 'the', 'expression', 'of', 'thoughts', 'for', 'in', 'order', 'to', 'be', 'able', 'to', 'draw', 'limit', 'to', 'thought', 'we', 'should', 'have', 'to', 'find', 'both', 'sides', 'of', 'the', 'limit', 'thinkable', 'we', 'should', 'have', 'to', 'be', 'able', 'to', 'think', 'what', 'cannot', 'be', 'thought']"," thus the aim of the book be to draw a limit to thought , or rather not to think , but to the expression of thought : for in order to be able to draw a limit to thought , -PRON- should have to find both side of the limit thinkable ( i.e. -PRON- should have to be able to think what can not be think ) ."
Tractatus Logico-Philosophicus,Wittgenstein,analytic,"따라서 한계는 언어로만 그려질 수 있으며, 한계 반대편에 있는 것은 단순히 말도 안 되는 것일 뿐입니다.","it will therefore only be in language that the limit can be drawn, and what lies on the other side of the limit will simply be nonsense.",1921,2001,136,"['it', 'will', 'therefore', 'only', 'be', 'in', 'language', 'that', 'the', 'limit', 'can', 'be', 'drawn', 'and', 'what', 'lies', 'on', 'the', 'other', 'side', 'of', 'the', 'limit', 'will', 'simply', 'be', 'nonsense']"," -PRON- will therefore only be in language that the limit can be draw , and what lie on the other side of the limit will simply be nonsense ."
Tractatus Logico-Philosophicus,Wittgenstein,analytic,저는 제 노력이 다른 철학자들의 노력과 얼마나 일치하는지 판단하고 싶지 않습니다.,i do not wish to judge how far my efforts coincide with those of other philosophers.,1921,2001,84,"['do', 'not', 'wish', 'to', 'judge', 'how', 'far', 'my', 'efforts', 'coincide', 'with', 'those', 'of', 'other', 'philosophers']", -PRON- do not wish to judge how far -PRON- effort coincide with those of other philosopher .
Tractatus Logico-Philosophicus,Wittgenstein,analytic,"실제로 제가 여기에 쓴 내용은 자세히 참신하다고 주장하지 않으며, 출처를 밝히지 않는 이유는 제가 가진 생각이 다른 누군가에 의해 예상되었는지 여부는 저에게는 무관심한 문제이기 때문입니다.","indeed, what i have written here makes no claim to novelty in detail, and the reason why i give no sources is that it is a matter of indifference to me whether the thoughts that i have had have been anticipated by someone else.",1921,2001,227,"['indeed', 'what', 'have', 'written', 'here', 'makes', 'no', 'claim', 'to', 'novelty', 'in', 'detail', 'and', 'the', 'reason', 'why', 'give', 'no', 'sources', 'is', 'that', 'it', 'is', 'matter', 'of', 'indifference', 'to', 'me', 'whether', 'the', 'thoughts', 'that', 'have', 'had', 'have', 'been', 'anticipated', 'by', 'someone', 'else']"," indeed , what -PRON- have write here make no claim to novelty in detail , and the reason why -PRON- give no source be that -PRON- be a matter of indifference to -PRON- whether the thought that -PRON- have have have be anticipate by someone else ."
Tractatus Logico-Philosophicus,Wittgenstein,analytic,저는 프레게의 위대한 작품과 제 친구 버트런드 러셀의 저서에서 많은 자극을 받았다는 점만 언급할게요.,i will only mention that i am indebted to frege's great works and to the writings of my friend mr bertrand russell for much of the stimulation of my thoughts.,1921,2001,158,"['will', 'only', 'mention', 'that', 'am', 'indebted', 'to', 'frege', 'great', 'works', 'and', 'to', 'the', 'writings', 'of', 'my', 'friend', 'mr', 'bertrand', 'russell', 'for', 'much', 'of', 'the', 'stimulation', 'of', 'my', 'thoughts']", -PRON- will only mention that -PRON- be indebte to Frege 's great work and to the writing of -PRON- friend Mr Bertrand Russell for much of the stimulation of -PRON- thought .
Tractatus Logico-Philosophicus,Wittgenstein,analytic,이 작품에 가치가 있다면 두 가지로 구성됩니다. 첫 번째는 생각이 표현되고이 점수에서 더 나은 것입니다.,"if this work has any value, it consists in two things: the first is that thoughts are expressed in it, and on this score the better",1921,2001,131,"['if', 'this', 'work', 'has', 'any', 'value', 'it', 'consists', 'in', 'two', 'things', 'the', 'first', 'is', 'that', 'thoughts', 'are', 'expressed', 'in', 'it', 'and', 'on', 'this', 'score', 'the', 'better']"," if this work have any value , -PRON- consist in two thing : the first be that thought be express in -PRON- , and on this score the well"
Tractatus Logico-Philosophicus,Wittgenstein,analytic,머리에 못을 박을수록 그 생각의 가치는 더 커질 것입니다.,the thoughts are expressed the more the nail has been hit on the head the greater will be its value.,1921,2001,100,"['the', 'thoughts', 'are', 'expressed', 'the', 'more', 'the', 'nail', 'has', 'been', 'hit', 'on', 'the', 'head', 'the', 'greater', 'will', 'be', 'its', 'value']", the thought be express the more the nail have be hit on the head the great will be -PRON- value .
Tractatus Logico-Philosophicus,Wittgenstein,analytic,여기서 저는 가능한 것에 한참 못 미친다는 것을 의식하고 있습니다.,here i am conscious of having fallen a long way short of what is possible.,1921,2001,74,"['here', 'am', 'conscious', 'of', 'having', 'fallen', 'long', 'way', 'short', 'of', 'what', 'is', 'possible']", here -PRON- be conscious of have fall a long way short of what be possible .
Tractatus Logico-Philosophicus,Wittgenstein,analytic,제 힘이 과제를 완수하기에는 너무 미약하기 때문입니다.,simply because my powers are too slight for the accomplishment of the task.,1921,2001,75,"['simply', 'because', 'my', 'powers', 'are', 'too', 'slight', 'for', 'the', 'accomplishment', 'of', 'the', 'task']", simply because -PRON- power be too slight for the accomplishment of the task .
Tractatus Logico-Philosophicus,Wittgenstein,analytic,다른 사람들이 와서 더 잘할 수 있기를 바랍니다.,may others come and do it better.,1921,2001,33,"['may', 'others', 'come', 'and', 'do', 'it', 'better']", May other come and do -PRON- better .
Tractatus Logico-Philosophicus,Wittgenstein,analytic,반면에 여기서 전달되는 생각의 진실은 저에게는 공격할 수 없고 결정적인 것처럼 보입니다.,on the other hand the truth of the thoughts that are here communicated seems to me unassailable and definitive.,1921,2001,111,"['on', 'the', 'other', 'hand', 'the', 'truth', 'of', 'the', 'thoughts', 'that', 'are', 'here', 'communicated', 'seems', 'to', 'me', 'unassailable', 'and', 'definitive']", on the other hand the truth of the thought that be here communicate seem to -PRON- unassailable and definitive .
Tractatus Logico-Philosophicus,Wittgenstein,analytic,따라서 저는 모든 본질적인 부분에서 문제의 최종 해결책을 찾았다고 생각합니다.,"i therefore believe myself to have found, on all essential points, the final solution of the problems.",1921,2001,102,"['therefore', 'believe', 'myself', 'to', 'have', 'found', 'on', 'all', 'essential', 'points', 'the', 'final', 'solution', 'of', 'the', 'problems']"," -PRON- therefore believe -PRON- to have find , on all essential point , the final solution of the problem ."
Tractatus Logico-Philosophicus,Wittgenstein,analytic,"그리고 내가이 믿음에 착각하지 않는다면,이 작품의 두 번째 가치는 이러한 문제가 해결 될 때 얼마나 적은 것을 성취하는지 보여주는 것입니다.","and if i am not mistaken in this belief, then the second thing in which the value of this work consists is that it shows how little is achieved when these problems are solved.",1921,2001,175,"['and', 'if', 'am', 'not', 'mistaken', 'in', 'this', 'belief', 'then', 'the', 'second', 'thing', 'in', 'which', 'the', 'value', 'of', 'this', 'work', 'consists', 'is', 'that', 'it', 'shows', 'how', 'little', 'is', 'achieved', 'when', 'these', 'problems', 'are', 'solved']"," and if -PRON- be not mistake in this belief , then the second thing in which the value of this work consist be that -PRON- show how little be achieve when these problem be solve ."
Tractatus Logico-Philosophicus,Wittgenstein,analytic,"비엔나, 세상이 전부입니다.","vienna, the world is all that is the case.",1921,2001,42,"['vienna', 'the', 'world', 'is', 'all', 'that', 'is', 'the', 'case']"," Vienna , the world be all that be the case ."
Tractatus Logico-Philosophicus,Wittgenstein,analytic,세상은 사물의 총합이 아니라 사실의 총합입니다.,"the world is the totality of facts, not of things.",1921,2001,50,"['the', 'world', 'is', 'the', 'totality', 'of', 'facts', 'not', 'of', 'things']"," the world be the totality of fact , not of thing ."
Tractatus Logico-Philosophicus,Wittgenstein,analytic,"세상은 사실에 의해 결정되며, 그 사실이 모든 사실입니다.","the world is determined by the facts, and by their being all the facts.",1921,2001,71,"['the', 'world', 'is', 'determined', 'by', 'the', 'facts', 'and', 'by', 'their', 'being', 'all', 'the', 'facts']"," the world be determine by the fact , and by -PRON- be all the fact ."
Tractatus Logico-Philosophicus,Wittgenstein,analytic,사실의 총합이 사실인 것과 사실이 아닌 것을 결정하기 때문입니다.,"for the totality of facts determines what is the case, and also whatever is not the case.",1921,2001,89,"['for', 'the', 'totality', 'of', 'facts', 'determines', 'what', 'is', 'the', 'case', 'and', 'also', 'whatever', 'is', 'not', 'the', 'case']"," for the totality of fact determine what be the case , and also whatever be not the case ."
Tractatus Logico-Philosophicus,Wittgenstein,analytic,논리적 공간의 사실이 곧 세상입니다.,the facts in logical space are the world.,1921,2001,41,"['the', 'facts', 'in', 'logical', 'space', 'are', 'the', 'world']", the fact in logical space be the world .
Tractatus Logico-Philosophicus,Wittgenstein,analytic,세상은 사실로 나뉩니다.,the world divides into facts.,1921,2001,29,"['the', 'world', 'divides', 'into', 'facts']", the world divide into fact .
Quintessence,Quine,analytic, 과학이 아닌 첨단, less a science a advanced,1950,2004,26,"['less', 'science', 'advanced']",   less a science a advanced
Quintessence,Quine,analytic,의 용어는 상호 이해라는 무비판적인 가정에 의존하는 경향이 있습니다.,", more its terminology tends rest on a uncritical assumption of mutual understanding.",1950,2004,85,"['more', 'its', 'terminology', 'tends', 'rest', 'on', 'uncritical', 'assumption', 'of', 'mutual', 'understanding']"," , more -PRON- terminology tend rest on a uncritical assumption of mutual understanding ."
Quintessence,Quine,analytic,리고가 증가함에 따라 정의의 도입이 단편적으로 대체되었습니다.,with increase of rigo this hasis is replaced piecemeal hy the introduction of definitions.,1950,2004,90,"['with', 'increase', 'of', 'rigo', 'this', 'hasis', 'is', 'replaced', 'piecemeal', 'hy', 'the', 'introduction', 'of', 'definitions']", with increase of rigo this hasis be replace piecemeal hy the introduction of definition .
Quintessence,Quine,analytic,"이러한 정의를 위해 모집된 상호 관계는 분석 원칙의 지위를 얻게 되고, 한때 세계에 대한 이론으로 간주되던 것이 언어의 관습으로 재구성됩니다.",the interrelationships recruited for these definitions gain the status of analytic principles; what was once regarded as a theory ahout the world becomes reconstrued as a convention of language.,1950,2004,194,"['the', 'interrelationships', 'recruited', 'for', 'these', 'definitions', 'gain', 'the', 'status', 'of', 'analytic', 'principles', 'what', 'was', 'once', 'regarded', 'as', 'theory', 'ahout', 'the', 'world', 'becomes', 'reconstrued', 'as', 'convention', 'of', 'language']", the interrelationship recruit for these definition gain the status of analytic principle ; what be once regard as a theory ahout the world become reconstrue as a convention of language .
Quintessence,Quine,analytic,따라서 이론적인 것에서 전통적인 것으로의 흐름은 모든 과학의 진보 논리적 토대의 보조적인 요소입니다.,thus it is that some flow from the theoretical to the conventional is a adj unct of progress logical foundations of any science.,1950,2004,128,"['thus', 'it', 'is', 'that', 'some', 'flow', 'from', 'the', 'theoretical', 'to', 'the', 'conventional', 'is', 'adj', 'unct', 'of', 'progress', 'logical', 'foundations', 'of', 'any', 'science']", thus -PRON- be that some flow from the theoretical to the conventional be a adj unct of progress logical foundation of any science .
Quintessence,Quine,analytic,원거리에서의 동시성 개념은 이러한 발전의 대표적인 예입니다. 아인슈타인은 이 문구를 정의로 무비판적으로 사용하는 대신에 광속의 절대성이라는 기존의 독소적 원리를 검증하기 위해 결정적 관계를 선택했습니다.,"concept of simultaneity at a distance affords a stock example of such development: in supplanting the uncritical use of this phrase by a definition, einstein so chose the definitive relationship as to verify conventionally the previously para doxical principle of the a bsoluteness of the speed of light.",1950,2004,304,"['concept', 'of', 'simultaneity', 'at', 'distance', 'affords', 'stock', 'example', 'of', 'such', 'development', 'in', 'supplanting', 'the', 'uncritical', 'use', 'of', 'this', 'phrase', 'by', 'definition', 'einstein', 'so', 'chose', 'the', 'definitive', 'relationship', 'as', 'to', 'verify', 'conventionally', 'the', 'previously', 'para', 'doxical', 'principle', 'of', 'the', 'bsoluteness', 'of', 'the', 'speed', 'of', 'light']"," concept of simultaneity at a distance afford a stock example of such development : in supplant the uncritical use of this phrase by a definition , Einstein so choose the definitive relationship as to verify conventionally the previously para doxical principle of the a bsoluteness of the speed of light ."
Quintessence,Quine,analytic,"그러나 물리 과학은 일반적으로 이러한 방향으로의 완전한 진화만을 인정하고 항상 비관습적인 교리의 핵심을 유지할 운명인 것으로 인식되는 반면, 지난 수십 년 동안의 발전은 논리와 수학이 순전히 분석적이거나 관습적이라는 광범위한 신념을 불러일으켰습니다.","but whereas the physical sciences arc generally recognized as capahle only of incom plete evolution in this direction, and as destined to retain always a non conventional kernel of doctrine, developments of the past few decades have led to a widespread conviction that logic and mathematics are purely analytic or conventional.",1950,2004,327,"['but', 'whereas', 'the', 'physical', 'sciences', 'arc', 'generally', 'recognized', 'as', 'capahle', 'only', 'of', 'incom', 'plete', 'evolution', 'in', 'this', 'direction', 'and', 'as', 'destined', 'to', 'retain', 'always', 'non', 'conventional', 'kernel', 'of', 'doctrine', 'developments', 'of', 'the', 'past', 'few', 'decades', 'have', 'led', 'to', 'widespread', 'conviction', 'that', 'logic', 'and', 'mathematics', 'are', 'purely', 'analytic', 'or', 'conventional']"," but whereas the physical sciences arc generally recognize as capahle only of incom plete evolution in this direction , and as destine to retain always a non conventional kernel of doctrine , development of the past few decade have lead to a widespread conviction that logic and mathematic be purely analytic or conventional ."
Quintessence,Quine,analytic,이 대비의 타당성에 의문을 제기하는 것보다는 그 의미에 의문을 제기하는 것이 현재 쿼리의 목적입니다.,it is less the purpose of the present in quiry to question the validity of this contrast than to question its sense.,1950,2004,116,"['it', 'is', 'less', 'the', 'purpose', 'of', 'the', 'present', 'in', 'quiry', 'to', 'question', 'the', 'validity', 'of', 'this', 'contrast', 'than', 'to', 'question', 'its', 'sense']", -PRON- be less the purpose of the present in quiry to question the validity of this contrast than to question -PRON- sense .
Quintessence,Quine,analytic,엄밀히 말하면 정의는 표기법의 규칙입니다.,"a definition, strictly, is a convention of notational a hhreviation.",1950,2004,68,"['definition', 'strictly', 'is', 'convention', 'of', 'notational', 'hhreviation']"," a definition , strictly , be a convention of notational a hhreviation ."
Quintessence,Quine,analytic,간단한 정의는 다음과 같은 특정 표현식을 도입합니다.,"a sim ple definition introduces some specific expression,.g.",1950,2004,60,"['sim', 'ple', 'definition', 'introduces', 'some', 'specific', 'expression']"," a sim ple definition introduce some specific expression,.g ."
Quintessence,Quine,analytic,", '킬로미터' 또는 'e'로, 일부 복잡한 표현식에 대한 임의의 약어로 정의라고 합니다.",", 'kilometer,' or 'e,' called the definielldum, as arhitrary shorthand for some complex expresj.",1950,2004,96,"['kilometer', 'or', 'called', 'the', 'definielldum', 'as', 'arhitrary', 'shorthand', 'for', 'some', 'complex', 'expresj']"," , ' kilometer , ' or ' e , ' call the definielldum , as arhitrary shorthand for some complex expresJ."
Quintessence,Quine,analytic,"버트런드 러셀, 수학의 원리, cs 캠브리지 참조:","see bertrand russell, principles of mathem,cs cambridge:",1950,2004,56,"['see', 'bertrand', 'russell', 'principles', 'of', 'mathem', 'cs', 'cambridge']"," see Bertrand Russell , Principles of Mathem , cs Cambridge :"
Quintessence,Quine,analytic,"캠브리지 유니티 프레스, ,.","cambridge uni ver ty press, ,.",1950,2004,30,"['cambridge', 'uni', 'ver', 'ty', 'press']"," Cambridge uni ver ty Press , , ."
Quintessence,Quine,analytic,"lI l': l': 시온, 예: '천 미터' 또는 림 +Ch(I, 정의라고 합니다.","li l': l': sion,.g., 'a thousand meters' or lim +ch (i, called the definiens.",1950,2004,77,"['li', 'sion', 'thousand', 'meters', 'or', 'lim', 'ch', 'called', 'the', 'definiens']"," lI l ' : l ' : sion,.g . , ' a thousand meter ' or lim + Ch ( i , call the definiens ."
